                           Functions Task
                         =================


1)Write a query to display emp table enames to uppercase?
Ans:
SQL> UPDATE EMP SET ENAME=UPPER(ENAME);
==========================================

2)Write a query to display emp table enames to lowercase?
Ans:
SQL> UPDATE EMP SET ENAME=LOWER(ENAME);
==========================================

3)Modify all emp table enames to initcap case perminently?
 Ans:
 SQL> UPDATE EMP SET ENAME=INITCAP(ENAME);
SQL> COMMIT;
===========================================

4)create table with fname,lastname insert the records as follows
Ans:
SQL> CREATE TABLE STUDENTS(FNAME VARCHAR2(6),LASTNAME VARCHAR2(4));
=========================================================
FNAME      LNAME     
---------- ---------- 
gowtham    raj        
naga       raj        
subba      rao        
kavya      sri

->add a new column NAME by using alter with add
 Ans:   
SQL>alter table students add name varchar2(10);
SQL>select * from students;
====================================

FNAME      LNAME        NAME
---------- -----     ---------
gowtham    raj       
naga       raj        
subba      rao        
kavya      sri        

--->set the output for the NAME column as follows
     NAME
  -----------
  Gowtham Raj
  Naga Raju
  Subba Rao
  Kavya Sri
Ans:
SQL> UPDATE STUDENTS SET NAME=INITCAP(FNAME)||' '||INITCAP(LASTNAME);
================================================
Hint:-our requirement is combine FNAME and LNAME means use 
====   concatination operator.and their starting letter
       of name column  is capital letter for that one use initcap
       store it in a NAME column by using single update command.

5)Write a query to display the emp records whose names
  having 4 characters?
Ans:
SQL> SELECT * FROM EMP WHERE LENGTH(ENAME)=4;
===============================================

6)display the emp records whose names are having more than 5
  charcters?
Ans:
SQL> SELECT * FROM EMP WHERE LENGTH(ENAME)>5;
===============================================

7)what the o/p of the following
SQL>select length('AB CD') from dual

A)4
B)5
C)6
D)none of the above
Ans:
B=5
===================================================

8)check the following substr() query output


SQL>select substr('ABCDEFGH',2,3) from dual;
Ans:
SUB
---
BCD

SQL> select substr('ABCDEFGH',-2,3) from dual; 
Ans:
SU
--
GH

SQL>select substr('GOWTHAM RAJ',1,7) from dual;
Ans:
SUBSTR(
-------
GOWTHAM

SQL)select substr('GOWTHAM RAJ',9) from dual;
Ans:
SUB
---
RAJ
         
SQL)select substr('GOWTHAM RAJ',4,4) from dual;
Ans:
SUBS
----
THAM

SQL)select substr('GOWTHAM RAJ',-1) from dual;
Ans:
S
-
J

SQL)select substr('GOWTHAM RAJ',-3,4) from dual;
Ans:
SUB
---
RAJ


9)create the table person as below
    pname                 dob           password
  ---------           ----------       ----------
  kiran kumar        30-june-96
 
genarate the password as kira96 by using substr()
Ans:
SQL> UPDATE PERSON SET PASSWORD=CONCAT(SUBSTR('kiran kumar',1,4),TO_CHAR(DOB,'YY'));
======================================================

10) write a query to display the employees whose ename second 
    letter would be LA from emp table using 
    substring function?
Ans:
SQL> SELECT * FROM EMP WHERE SUBSTR(ENAME,2,2)='LA';
===================================================

11)write a query to display employee records whose name started
   with M by using substring function?
Ans:
SQL> SELECT * FROM EMP WHERE SUBSTR(ENAME,1,1)='M';
===================================================

12) write a query to display employee records whose
    names are started with vowel by using 
    substring function?
Ans:
SQL> SELECT * FROM EMP WHERE SUBSTR(ENAME,1,1)IN('A','E','I','O','U');
============================================================

13)write a query to display employee records whose name
   started and end with same letter by using 
   substring function?
Ans:
SQL> SELECT * FROM EMP WHERE SUBSTR(ENAME,1,1)=SUBSTR(ENAME,-1,1);
=================================================================

14)write a query to display employee records whose name
   started and end with vowel letter by using
   substring function?
Ans:
SQL> SELECT * FROM EMP WHERE SUBSTR(ENAME,1,1) IN('A','E','I','O','U') AND SUBSTR(ENAME,-1,1) IN('A','E','I','O','U');
=================================================================




